# id	sub	bounty	ncom	ageH	tags	title
1482006	bitcoin	0	1	1.6	FRESH,HOT	Bisq vulnerability being exploited, trading halted
1481605	bitcoin	0	13	17.9	HOT	Are we in a bear market of money itself?
1481734	bitcoin	0	3	14.9	HOT	Bitcoin Research Prize Nomination 2026 - Chaincode
1482000	bitcoin	0	1	1.8	FRESH	How much of Bitcoin mining economics does the average Bitcoiner misunderstand?
1481447	bitcoin	0	13	22.5	HOT	What confused you most as a Bitcoin beginner?
1481655	bitcoin	0	1	17.0	HOT	If the Quantum Canary Sings, It’s Too Late
1481509	bitcoin	0	6	20.6	HOT	The Bitcoin Evidence Base - Bitcoin FUD responder
1481528	meta	0	14	20.2	HOT	New Series coming to Stacker News: NEED's picks on Predyx
1481494	bitcoin	0	12	21.0	HOT	Teaser: "I Found some lost and forgotten Satoshi messages - from Nov 2009..."
1481594	bitcoin	0	1	18.3	HOT	SatoshiGuesser – Roll for Bitcoin
1481528	meta	0	14	20.2	HOT	New Series coming to Stacker News: NEED's picks on Predyx
1481789	tech	0	4	11.9	HOT	My Daughter Died at 32. My Devices Won’t Let Me Rest | WSJ
1481567	lol	0	10	18.9		What the hell is a Bitcoin super-app?
1481711	bitcoin	0	0	16.1		First release for sparrow-joinstr v0.1.0 (alpha)
1481601	bitcoin	0	3	18.2		Coldcard question
1481469	bitcoin	0	3	21.9		The Simpler Trade: Digital Credit Risk Analysis – Onramp
1481724	bitcoin	0	2	15.4		Piggy is now on Android
1481492	gaming	0	0	21.0		SAT SEER | Round 26 | What's the title?
1481474	bitcoin	0	1	21.8		⚡️ 30 Minutes To Alby Community Call ⚡️
1481990	meta	0	0	2.1		This Day on SN: May 1
1481815	meta	0	4	11.4		Sign up for Stacker News with Lightning?
1481743	tech	0	3	14.2		Rivian allows you to disable all internet connectivity
