# id	sub	bounty	ncom	ageH	tags	title
1483790	bitcoin	0	10	12.6	HOT	Summary of "Finding Satoshi.." by my 9 year old
1483697	bitcoin	0	16	16.8	HOT	Will you heed my warnings NOW? - Scott Aaronson
1483990	bitcoin	0	1	3.6		Bitcoin, Surveillance, and Why Patience Is a Strategy - American Hodl
1483807	bitcoin	0	0	10.9		Hände Weg von Der Spekulationsfrist (Hands off the speculation period)
1483567	bitcoin	0	2	20.8		Lyn Alden vs Mike Brock: money, commerce, governance, and more
1483576	bitcoin	0	0	20.5		Ever thought about adding a passphrase to your main wallet?
1483850	meta	0	0	8.1		This Day on SN: May 4
